{
  "$id": "bureau_audio_plan_v1.schema.json", "$schema": "https://json-schema.org/draft/2020-12/schema",
  "type": "object", "additionalProperties": false,
  "required": ["schema_version", "artifact_type", "artifact_id", "property_id", "episode_id", "created_at", "generator_version", "upstream_artifacts", "narrator_profile", "performance_instructions", "pronunciation", "pacing", "script_timing", "music_language", "soundscape", "diegetic_sounds", "warning_tones", "silence", "synchronization", "platform_mix_targets"],
  "properties": {
    "schema_version": {"$ref": "common_defs_v1.schema.json#/$defs/schema_version"}, "artifact_type": {"const": "bureau_audio_plan_v1"}, "artifact_id": {"$ref": "common_defs_v1.schema.json#/$defs/artifact_id"}, "property_id": {"$ref": "common_defs_v1.schema.json#/$defs/property_id"}, "episode_id": {"$ref": "common_defs_v1.schema.json#/$defs/episode_id"}, "created_at": {"$ref": "common_defs_v1.schema.json#/$defs/created_at"}, "generator_version": {"$ref": "common_defs_v1.schema.json#/$defs/generator_version"}, "upstream_artifacts": {"$ref": "common_defs_v1.schema.json#/$defs/upstream_artifacts"},
    "narrator_profile": {"type": "object", "additionalProperties": false, "required": ["voice_origin", "register", "delivery", "real_person_imitation"], "properties": {"voice_origin": {"const": "original"}, "register": {"const": "warm_bureau_baritone"}, "delivery": {"$ref": "common_defs_v1.schema.json#/$defs/string_list"}, "real_person_imitation": {"const": false}}},
    "performance_instructions": {"$ref": "common_defs_v1.schema.json#/$defs/string_list"}, "pronunciation": {"type": "array", "maxItems": 50, "items": {"type": "object", "additionalProperties": false, "required": ["term", "phonetic"], "properties": {"term": {"$ref": "common_defs_v1.schema.json#/$defs/nonempty_string"}, "phonetic": {"$ref": "common_defs_v1.schema.json#/$defs/nonempty_string"}}}}, "pacing": {"type": "object", "additionalProperties": false, "required": ["words_per_minute", "cadence"], "properties": {"words_per_minute": {"type": "integer", "minimum": 100, "maximum": 190}, "cadence": {"$ref": "common_defs_v1.schema.json#/$defs/nonempty_string"}}}, "script_timing": {"type": "object", "additionalProperties": false, "required": ["target_duration_ms", "maximum_words"], "properties": {"target_duration_ms": {"type": "integer", "minimum": 45000, "maximum": 60000}, "maximum_words": {"type": "integer", "minimum": 75, "maximum": 190}}}, "music_language": {"$ref": "common_defs_v1.schema.json#/$defs/string_list"}, "soundscape": {"$ref": "common_defs_v1.schema.json#/$defs/string_list"}, "diegetic_sounds": {"$ref": "common_defs_v1.schema.json#/$defs/string_list"}, "warning_tones": {"$ref": "common_defs_v1.schema.json#/$defs/string_list"}, "silence": {"$ref": "common_defs_v1.schema.json#/$defs/string_list"}, "synchronization": {"$ref": "common_defs_v1.schema.json#/$defs/string_list"},
    "platform_mix_targets": {"type": "object", "additionalProperties": false, "required": ["integrated_lufs", "true_peak_db", "dialogue_priority"], "properties": {"integrated_lufs": {"type": "integer", "minimum": -24, "maximum": -8}, "true_peak_db": {"type": "integer", "minimum": -6, "maximum": -1}, "dialogue_priority": {"const": true}}}
  }
}
